{
  "scene_contract": {
    "contract_id": "scene-lv-starbucks-v0",
    "location_id": "place:starbucks:3105-w-26th-chicago",
    "zone": "exterior_entrance",
    "target_snapshot": {
      "as_of": "2026-08-29T00:00:00Z",
      "max_appearance_age_days": 180
    },
    "required_anchors": [
      "primary_storefront",
      "entrance_position",
      "parking_axis",
      "adjacent_plaza_context"
    ],
    "mutable_regions": ["foreground_subject_mask"],
    "format": {
      "image_count": 1,
      "standalone": true,
      "aspect_ratio": "9:16",
      "collage": false,
      "text_overlay": false
    },
    "render_policy": {
      "allowed_modes": [
        "immutable_plate",
        "multiview_reconstruction",
        "constrained_generation"
      ],
      "prefer_least_generative": true
    },
    "required_gates": [
      "G_LOCATION_IDENTITY",
      "G_RIGHTS",
      "G_SPATIAL",
      "G_VIEW_CONE",
      "G_TEMPORAL",
      "G_SUBJECT_CANON",
      "G_FORMAT",
      "G_RENDER_POLICY",
      "G_OBJECT_INTEGRITY",
      "G_PROVENANCE"
    ]
  },
  "location_passport": {
    "location_id": "place:starbucks:3105-w-26th-chicago",
    "canonical_name": "Starbucks Coffee Company — Little Village",
    "canonical_address": "3105 W 26th St, Chicago, IL 60623",
    "centroid": {"lat": 41.8447, "lon": -87.7028},
    "osm_ids": [],
    "aliases": [
      "Little Village Starbucks",
      "3105 W 26th St Starbucks",
      "Little Village — 26th & Whipple"
    ],
    "adjacent_anchors": [
      "Little Village Discount Mall",
      "W 26th Street corridor"
    ],
    "zones": [
      "exterior_parking_approach",
      "exterior_sidewalk",
      "exterior_entrance",
      "exterior_patio",
      "interior_counter",
      "interior_community_table",
      "interior_mural_wall"
    ],
    "structural_invariants": [
      "primary_storefront",
      "entrance_position",
      "parking_axis",
      "adjacent_plaza_context"
    ],
    "semipermanent_invariants": [
      "magenta_facade_field",
      "dark_storefront_band",
      "green_patio_umbrellas",
      "community_mural",
      "dark_linear_ceiling",
      "warm_wood_furniture"
    ],
    "prohibited_mutations": [
      "brick_corner_store",
      "downtown_streetwall",
      "detached_rustic_lodge",
      "generic_drive_through",
      "interior_exterior_blending",
      "parking_axis_rotation",
      "entrance_relocation"
    ],
    "evidence_node_ids": [
      "ev-user-reference-set-001",
      "ev-osm-metadata-001"
    ]
  },
  "evidence": [
    {
      "evidence_id": "ev-user-reference-set-001",
      "kind": "image",
      "role": "location_plate",
      "authority": "location_truth",
      "content_hash": "1111111111111111111111111111111111111111111111111111111111111111",
      "captured_at": "2026-08-29T00:00:00Z",
      "acquired_at": "2026-08-29T00:00:00Z",
      "location": {"lat": 41.8447, "lon": -87.7028},
      "zone": "exterior_entrance",
      "temporal_class": "current_appearance",
      "source_uri": null,
      "rights": {
        "status": "allowed",
        "source_type": "user_owned",
        "license": null,
        "terms_uri": null,
        "permitted_uses": [
          "retrieval",
          "validation",
          "reconstruction",
          "derivative_generation",
          "display"
        ],
        "notes": "Placeholder hash only. Replace with hashes of actual user-supplied reference assets before a real receipt."
      },
      "derived_from": []
    },
    {
      "evidence_id": "ev-osm-metadata-001",
      "kind": "map_feature",
      "role": "metadata",
      "authority": "location_truth",
      "content_hash": "2222222222222222222222222222222222222222222222222222222222222222",
      "captured_at": null,
      "acquired_at": "2026-08-29T00:00:00Z",
      "location": {"lat": 41.8447, "lon": -87.7028},
      "zone": null,
      "temporal_class": "metadata",
      "source_uri": "https://www.openstreetmap.org/",
      "rights": {
        "status": "allowed",
        "source_type": "open_data",
        "license": "ODbL-1.0",
        "terms_uri": "https://www.openstreetmap.org/copyright",
        "permitted_uses": ["metadata", "retrieval", "validation"],
        "notes": "Record attribution and ODbL obligations in production export."
      },
      "derived_from": []
    }
  ],
  "rights_manifest": {
    "verdict": "PASS",
    "evidence_decisions": {
      "ev-user-reference-set-001": "allowed",
      "ev-osm-metadata-001": "allowed"
    }
  },
  "view_cone": {
    "origin": {"lat": 41.84465, "lon": -87.70275},
    "yaw_deg": 118,
    "pitch_deg": -3,
    "roll_deg": 0,
    "horizontal_fov_deg": 73,
    "position_uncertainty_m": 5,
    "orientation_uncertainty_deg": 8,
    "visible_anchors": [
      "primary_storefront",
      "entrance_position",
      "parking_axis",
      "adjacent_plaza_context"
    ],
    "may_be_visible": [
      "green_patio_umbrellas",
      "parked_vehicles",
      "landscaped_planters"
    ],
    "must_not_be_visible": [
      "interior_mural_wall",
      "downtown_skyscrapers",
      "generic_drive_through"
    ]
  },
  "render_plan": null,
  "grounding_receipt": null
}
